{
  "report_slug": "ai-analyst-l5-scenario",
  "created_at": "2026-06-02T09:10:16Z",
  "decision_question": "Which acquisition channel has the highest churn and what should we do about it?",
  "sources": [
    {
      "source_id": "src-paid-search",
      "title": "Synthetic churn snapshot",
      "source_type": "dataset",
      "locator": "/tmp/ai-analyst-scenario-workspace/data/product_a/orders.csv",
      "captured_at": "2026-06-02T09:10:16Z",
      "summary": "Small sample showing paid search with a higher observed churn share.",
      "raw_evidence": [
        {
          "evidence_id": "ev1",
          "kind": "stat",
          "text": "Paid search appears in both retained and churned rows, but carries the largest revenue at risk.",
          "locator": "orders.csv"
        }
      ],
      "claims": [
        {
          "claim_id": "cl1",
          "statement": "Paid search is the highest-risk acquisition channel in the synthetic sample.",
          "confidence": "medium",
          "evidence_ids": [
            "ev1"
          ]
        }
      ],
      "use_case_hints": [
        {
          "label": "churn triage",
          "rationale": "Marketing channel efficiency and retention risk can be reviewed together."
        }
      ]
    }
  ]
}
